1770989706,focused or stuck together: multimodal patterns reveal triads' performance in collaborative problem solving,Hana Vrzakova,2020,Learning,"AUDIO,VIDEO,SCREEN,SURVEY,PPA","PROS,ACT,GEST,PPA","STATS,PATT",MID,LAK,VIRT,STEM,MULTI,INSTR,UNI,MF,"We found that idling with limited speech (i.e., silence or backchannel feedback only) and without movement was negatively correlated with task performance and with participants’ subjective perceptions of the collaboration. However, being silent and focused during solution execution was positively correlated with task performance. Results illustrate that in some cases, multimodal patterns improved the predictions and improved explanatory power over the unimodal primitives.

""Here, we examine unimodal primitives (activity on the screen, speech, and body movements), and their multimodal combinations during remote CPS.""

Mixed findings for uni- versus multi-modal:

""These results lead us to question: are the multimodal patterns better than the unimodal primitives? As illustrated above, we found evidence for both sides of the argument. In the case of code execution, the answer is no, but it is a yes in the case of idling. However, it is important to go beyond the significant correlations as there is an informative signal in the non-significant ones as well. For example, consider idling once again. By itself, this pattern is negatively correlated with the task score (r = -.21) and the correlation is even more negative when idling is accompanied by silence/back channeling and little movement (r = -.35). However, there are many other configurations where idling is weak or negligible predictor of task score. For example, idling occurring in the context of the contributors speaking with some movement is more weakly correlated with task score (r = -.11) and the correlation is essentially null when idling is accompanied with the controller speaking and some movement (r = -.06). Thus, even when they do not improve predictive power, multimodal patterns help contextualize and reveal nuances in the unimodal primitives. This supports the overall idea of multimodal learning analytics in which the additional modalities (speech and body movement in our case) help to understand unclear patterns such as idling. This finding is interesting from two perspectives."""
3051560548,temporal analysis of multimodal data to predict collaborative learning outcomes,Jennifer K. Olsen,2020,Learning,"LOGS,AUDIO,EYE","GAZE,LOGS,PROS,TRANS,QUAL",REG,MID,BJET,VIRT,STEM,MULTI,INSTR,K12,MB,"Assessing the relation of dual gaze, tutor log, audio and dialog data to students’ learning gains, we find that a combination of modalities, especially those at a smaller time scale, such as gaze and audio, provides a more accurate prediction of learning gains than models with a single modality.

Evaluating how multimodal features contribute to a model's performance to predict learning gains. Audio features introduce noise that negatively impacted the error of the model."
3796643912,an evaluation of an adaptive learning system based on multimodal affect recognition for learners with intellectual disabilities,Penelope J. Standen,2020,Learning,"VIDEO,AUDIO,LOGS,RPA","AFFECT,POSE,LOGS,RPA,GAZE,PROS,GEST","CLS,STATS",HYBRID,BJET,VIRT,"HUM, OTH, STEM",IND,INSTR,K12,MB,"This is the first study to evaluate an adaptive learning system for learners with ID based on multi-modal affect recognition. Three separate states were automatically identified, with lower levels of the state labelled “boredom” having the strongest link to learning achievement. Both those labelled “frustration” and “engagement” were positively related to achievement. Our results are in line with other studies showing that engagement increases when activities are tailored to the personal needs
and emotional states of learners (Athanasiadis et al., 2017), but no significant difference in learn-ing achievement was found (at least for the period of our study) when adaption was based on both the affective state and achievement of the learner, compared with achievement alone.

Results suggest that engagement does increase when activities are tailored to the personal needs and emotional state of the learner and that the system was promoting affective states that in turn promote learning. However, longer exposure is necessary to determine the effect on learning."
2634033325,controlled evaluation of a multimodal system to improve oral presentation skills in a real learning setting,Xavier Ochoa,2020,Training,"VIDEO,AUDIO,PPA","POSE,PROS,PPA",STATS,OTH,BJET,BLND,HUM,IND,TRAIN,UNSP,MF,"Evidence found in this paper suggests that automated feedback has a positive effect on oral presentation quality, but that the strength of this effect is small. Furthermore, different oral presentation dimensions are affected differently by the use of the system (i.e., there are large gains in looking at the audience during the presentation, while there is a negligible improvement in the avoidance of filled pauses)

Authors showcase that the training tool improved manually defined scores between an initial and second use of the tool."
1426267857,"affect, support, and personal factors: multimodal causal models of one-on-one coaching",Lujie Karen Chen,2021,Learning,"AUDIO,VIDEO,SURVEY","PROS,GAZE,TRANS,AFFECT,SURVEY","STATS,NET",HYBRID,JEDM,PHYS,STEM,IND,INSTR,K12,MB,"""this research contributes to the relatively sparse literature in multimodal learning analytics by providing a balanced view of the teacher and student interactions with a data set collected in naturalistic home environments.""

""Firstly, we note a clear causal pathway between the group of variables describing parents’ support and another group representing the child’s cognitive-affective experience.""

""Secondly, we note the causal pathway from Profile to Affect and, indirectly, to Support."""
666050348,multicraft: a multimodal interface for supporting and studying learning in minecraft,Marcelo Worsley,2021,Learning,"AUDIO,EYE,TEXT,VIDEO,SCREEN,INTER,SURVEY,LOGS","PROS,TRANS,GAZE,TEXT,INTER,SURVEY,LOGS",QUAL,OTH,HCII,VIRT,STEM,IND,INF,K12,MF,"""Through our user studies, we found that the platform helps fulfill some of those goals by providing capabilities that can spur on amazement and excitement among traditional Minecraft users and novices. We also find that many of the multimodal components, while not immediately intuitive for users, proved to be preferred modes of game play. In this sense, we feel that this tool is moving in the right direction in terms of the system capabilities that it provides. Our analyses also point to the meaningful ways that multimodal data can be used to study student learning in these game-based environments, and free students from standardized testing and learning experiences.""

""Through our user studies, we found that the platform helps fulfill some of those goals by providing capabilities that can spur on amazement and excitement among traditional Minecraft users and novices. We also find that many of the multimodal components, while not immediately intuitive for users, proved to be preferred modes of game play."""
518268671,using multimodal learning analytics to explore collaboration in a sustainability co-located tabletop game,María Ximena López,2021,Learning,"SURVEY,LOGS,AUDIO,VIDEO","LOGS,SURVEY,GAZE,PROS",STATS,OTH,ECGBL,BLND,STEM,MULTI,INSTR,UNI,MF,"Overall, our study suggests that coupling style can be operationalised as a multimodal indicator suitable to investigate complex collaboration dynamics in games, thus confirming what has been found in other domains

""Firstly, we found that coupling styles can be used to characterise collaboration in a co-located SG. Consistently with previous research (Isenberg et al, 2010; Niu et al, 2018), our results showed that teams displayed both close and loose coupling styles while performing individual actions to accomplish shared goals. Interestingly, we found a positive association between the time spent working closely coupled and the individual interactions with the technology. This suggests that the pursuit of collective goals requires players to continuously alternate and integrate individual planning and action with closely-coupled, likely to verify and synchronise their own actions with others. Secondly, we found that the perceived quality of collaboration does not appear to be an effective indicator of collaboration quality by itself. However, its small association with close-coupling style suggests a conscious, continuous, and proactive approach to collaboration, since players who appreciate the value of collaboration also seem to actively engage in closely-coupled interactions with others. Thirdly, our findings suggest that better-performing teams do work more closely-coupled and alternate their interactions with individual work. This result indicates that freely alternating individual work with closely-coupled interaction is an effective collaboration strategy, and that collaborative SGs should afford this opportunity. Overall, our study suggests that coupling style can be operationalised as a multimodal indicator suitable to investigate complex collaboration dynamics in games, thus confirming what has been found in other domains (Isenberg et al, 2010; Niu et al, 2018)."""
2273914836,many are the ways to learn identifying multi-modal behavioral profiles of collaborative learning in constructivist activities,Jauwairia Nasir,2022,Learning,"VIDEO,AUDIO,LOGS,PPA,SURVEY","PROS,AFFECT,GAZE,TRANS,LOGS","STATS,QUAL,CLUST,CLS",HYBRID,IJCSCL,BLND,STEM,MULTI,INSTR,K12,MB,"""Our combined multi-modal learning analytics and interaction analysis methodology enabled us to identify two multi-modal profles of learners who have learning gains and one multi-modal profle of learners who do not have learning gains.""

""Using this approach, we are able to build the multimodal behavioral profles for each group of learners.""

""Our combined multi-modal learning analytics and interaction analysis methodology enabled us to identify two multi-modal profles of learners who have learning gains and one multi-modal profle of learners who do not have learning gains."""
32184286,once more with feeling: emotions in multimodal learning analytics,Marcus Kubsch,2022,Learning,"SURVEY,PPA,AUDIO","INTER,SURVEY,TRANS,PROS,AFFECT","CLS,REG,STATS",OTH,MMLA Handbook,PHYS,STEM,IND,INSTR,K12,"MB, MF","Results demonstrate how NLP and ML techniques allow us to use different modalities of the same data, voice and transcript, and different modalities of different data sources, voice data from interviews, answers to a goal orientation questionnaire, and answers to open-ended questions about energy, in order to better understand individual differences in students’ performances

Used text and audio to predict student's affect. With the affect, the authors' explored its statistical relation to student's knowledge. Results point that they need more data to improve performance in affect prediction but promising direction."
2609260641,visualizing collaboration in teamwork: a multimodal learning analytics platform for non-verbal communication,René Noël,2022,Learning,"AUDIO,VIDEO,RPA,INTER","PROS,POSE,RPA,INTER,QUAL",QUAL,OTH,DAMLE,PHYS,HUM,MULTI,INF,"PROF, UNI",MF,"""We conducted a case study to compare the visualizations provided by the system in two different situations: collaborative and competitive activities. The results suggest that the provided visualizations help to identify issues on cognitive contribution, assimilation, self-regulation, and integration of the team members. They could also support teachers to decide whether they must assist a team in fostering collaboration.

While the results are naturally constrained to the characteristics of the activities in which we tested the platform, they provide initial evidence about the technical fea-
sibility of extracting behavioral indicators and traces using MMLA to give insights onteam collaboration.""

""The results suggest that the provided visualizations help to identify issues on cognitive contribution, assimilation, self-regulation, and integration of the team members. They could also support teachers to decide whether they must assist a team in fostering collaboration."""
1345598079,intermodality in multimodal learning analytics for cognitive theory development: a case from embodied design for mathematics learning,Sofia Tancredi,2022,Learning,"EYE,VIDEO,AUDIO,INTER","GAZE,GEST,TRANS,POSE,INTER","PATT,QUAL,STATS",OTH,MMLA Handbook,VIRT,STEM,IND,INSTR,K12,MF,"""Looking intermodally across hand and gaze dynamics, each stage was characterized by distinct meta patterns: disconfluence of hand and gaze during Exploration, increasing confluence during Discovery, and high confluence during Fluency.""

""Looking intermodally across hand and gaze dynamics, each stage was characterized by distinct meta patterns: disconfluence of hand and gaze during Exploration, increasing confluence during Discovery, and high confluence during Fluency. Towards the end of the Discovery stage, a coordination of coordinations (Piaget, 1970) developed wherein the coordination between the left- and right hands became coordinated with newly developed gaze structures spanning different screen locations.""

""Our findings point to the importance of MMLA work that attunes to intermodal dynamics of learning, both as a pragmatic resource for identifying key moments in learning and as a resource for refining theoretical understandings of learning processes."""
2155422499,a multimodal analysis of pair work engagement episodes: implications for emi lecturer training,Teresa Morell,2022,Training,"VIDEO,AUDIO,PPA","TRANS,PPA,QUAL,POSE,ACT",QUAL,OTH,JEAP,PHYS,OTH,MULTI,TRAIN,PROF,MF,"""In this study, we have given special emphasis to the interpersonal metafunction (see Fig. 1), which is crucial to enhance EMI students’ active participation and engagement. The outcomes of this study point to the need to address multimodal interactional competence in professional development programs, as described in Morell et al. (2022) to promote effective lecturing in the diverse EMI scenarios.""

""The exploration of how EMI lecturers use semiotic resources to construct meaning and to create engagement paves the way to a unified multimodal interactional competence. In general, the mastery of this competence enables lecturers to convert students from passive listeners/observers to active participants, giving them opportunities to engage in active learning, language usage and critical thinking."""
3754172825,detecting impasse during collaborative problem solving with multimodal learning analytics,Yingbo Ma,2022,Learning,"VIDEO,AUDIO","TRANS,PROS,SPECT,GAZE,POSE",CLS,HYBRID,LAK,VIRT,STEM,MULTI,INSTR,K12,MB,"""We found that the semantics and speaker information in the linguistic modality, the pitch variation in the audio modality, and the facial muscle movements in the video modality are the most significant unimodal indicators of impasse.""

""We found that the semantics and speaker information in the linguistic modality, the pitch variation in the audio modality, and the facial muscle movements in the video modality are the most significant unimodal indicators of impasse. We also trained several multimodal models and found that combining indicators from these three modalities provided the best impasse detection performance."""
